{
  "requestId": "synthetic-request-bypass-005",
  "decision": "deny",
  "reasonCode": "synthetic-direct-runtime-bypass",
  "policySignal": "deny",
  "guardrailSignal": "not-evaluated",
  "policy": { "policyId": "synthetic-policy-knowledge-lookup", "policyVersion": "synthetic-v1", "trustStatus": "trusted" },
  "guardrail": { "guardrailId": "synthetic-guardrail-knowledge-lookup", "guardrailVersion": "synthetic-v1", "trustStatus": "trusted" },
  "session": { "sessionId": "synthetic-session-005", "state": "closed", "limit": 3 },
  "budget": { "consumed": 0, "limit": 10, "state": "not-applicable" },
  "evidence": { "evidenceId": "synthetic-evidence-005", "redactionStatus": "metadata-only", "recordedAt": "2026-08-14T00:04:01Z" }
}
